{
  "$schema": "./species.schema.json",
  "formatVersion": 2,
  "contentRevision": 11,
  "species": [
    {
      "id": "combat.wild.species.spirit-fox",
      "name": "烛尾狐",
      "realm": "炼气",
      "icon": "🦊",
      "description": "灰白小狐，尾端长毛聚起灵火时宛如烛芯；夜间常蹲在灵泉旁，将蓬尾绕至身前，以尾尖火光映脸。",
      "carryLevel": 5,
      "starter": true,
      "aptitudes": {
        "attack": {
          "min": 672,
          "max": 840
        },
        "defense": {
          "min": 864,
          "max": 1080
        },
        "health": {
          "min": 2880,
          "max": 3600
        },
        "mana": {
          "min": 1536,
          "max": 1920
        },
        "speed": {
          "min": 864,
          "max": 1080
        }
      },
      "growthMilli": {
        "min": 982,
        "max": 1030
      },
      "birthSkills": {
        "core": ["beast.spirit-flame"],
        "candidates": ["beast.wisdom", "beast.meditation"]
      }
    },
    {
      "id": "combat.wild.species.rock-boar",
      "name": "钢背猪",
      "realm": "炼气",
      "icon": "🐗",
      "description": "身躯矮壮，肩背高耸，钢灰硬皮自颈后连至臀部；性情暴躁，稍受惊扰便喷鼻冲撞，受击时立即转身顶向来敌。",
      "carryLevel": 5,
      "starter": true,
      "aptitudes": {
        "attack": {
          "min": 816,
          "max": 1020
        },
        "defense": {
          "min": 1180,
          "max": 1440
        },
        "health": {
          "min": 3960,
          "max": 4950
        },
        "mana": {
          "min": 1536,
          "max": 1920
        },
        "speed": {
          "min": 576,
          "max": 720
        }
      },
      "growthMilli": {
        "min": 1012,
        "max": 1060
      },
      "birthSkills": {
        "core": ["beast.defense"],
        "candidates": ["beast.counter", "beast.sluggish", "beast.strength"]
      }
    },
    {
      "id": "combat.wild.species.wind-wolf",
      "name": "精灵狼",
      "realm": "炼气",
      "icon": "🐺",
      "description": "身形轻瘦，灰银细毛，耳尖与尾缘泛着淡青光泽；警觉时隐去身形，潜伏于幽林，待猎物走近才突然扑出。",
      "carryLevel": 5,
      "starter": true,
      "aptitudes": {
        "attack": {
          "min": 1104,
          "max": 1380
        },
        "defense": {
          "min": 624,
          "max": 780
        },
        "health": {
          "min": 2160,
          "max": 2700
        },
        "mana": {
          "min": 960,
          "max": 1200
        },
        "speed": {
          "min": 864,
          "max": 1080
        }
      },
      "growthMilli": {
        "min": 952,
        "max": 1000
      },
      "birthSkills": {
        "core": ["beast.stealth"],
        "candidates": ["beast.sneak-attack", "beast.agility"]
      }
    },
    {
      "id": "combat.wild.species.mimi",
      "name": "咪咪",
      "realm": "炼气",
      "icon": "icon:beast-mimi",
      "description": "银灰虎斑的小灵猫，圆脸短足，胸腹雪白，四爪如穿白袜。常将前爪拢在胸前伏成一团，长尾绕身；灵息稍有异动，便竖耳抬头，以黄绿圆眼凝望来处。",
      "carryLevel": 5,
      "starter": true,
      "aptitudes": {
        "attack": {
          "min": 780,
          "max": 1050
        },
        "defense": {
          "min": 820,
          "max": 1090
        },
        "health": {
          "min": 3300,
          "max": 4300
        },
        "mana": {
          "min": 1320,
          "max": 1800
        },
        "speed": {
          "min": 720,
          "max": 990
        }
      },
      "growthMilli": {
        "min": 990,
        "max": 1060
      },
      "birthSkills": {
        "core": [],
        "candidates": ["beast.perception", "beast.parry", "beast.regeneration"]
      }
    },
    {
      "id": "combat.wild.species.fire-crow",
      "name": "火鸦",
      "realm": "筑基",
      "icon": "icon:beast-fire-crow",
      "description": "黑羽赤喉，翼下藏有暗红火羽，振翅时散出火星；常衔焦枝，在地火裂隙旁筑巢。",
      "carryLevel": 25,
      "starter": false,
      "aptitudes": {
        "attack": {
          "min": 720,
          "max": 980
        },
        "defense": {
          "min": 700,
          "max": 940
        },
        "health": {
          "min": 2700,
          "max": 3500
        },
        "mana": {
          "min": 1800,
          "max": 2300
        },
        "speed": {
          "min": 950,
          "max": 1280
        }
      },
      "growthMilli": {
        "min": 1020,
        "max": 1090
      },
      "birthSkills": {
        "core": ["beast.wildfire"],
        "candidates": ["beast.meditation", "beast.spell-fluctuation"]
      }
    },
    {
      "id": "combat.wild.species.red-tail-scorpion",
      "name": "双尾蝎",
      "realm": "筑基",
      "icon": "🦂",
      "description": "沙褐甲壳，腹后生着两条暗红毒尾，静伏时交叠于背，受惊后分别扬起；白日藏石缝，夜间循震动捕猎。",
      "carryLevel": 25,
      "starter": false,
      "aptitudes": {
        "attack": {
          "min": 1050,
          "max": 1390
        },
        "defense": {
          "min": 1040,
          "max": 1320
        },
        "health": {
          "min": 2500,
          "max": 3300
        },
        "mana": {
          "min": 900,
          "max": 1250
        },
        "speed": {
          "min": 780,
          "max": 1150
        }
      },
      "growthMilli": {
        "min": 1010,
        "max": 1080
      },
      "birthSkills": {
        "core": ["beast.poison"],
        "candidates": ["beast.sneak-attack", "beast.defense"]
      }
    },
    {
      "id": "combat.wild.species.stoneback-bear",
      "name": "抱月熊",
      "realm": "筑基",
      "icon": "🐻",
      "description": "深褐长毛，胸腹有浅金圆斑，常坐倚老树，前掌拢腹如抱满月；受伤后蜷身长眠，受逼近时骤起反扑。",
      "carryLevel": 25,
      "starter": false,
      "aptitudes": {
        "attack": {
          "min": 1100,
          "max": 1420
        },
        "defense": {
          "min": 980,
          "max": 1260
        },
        "health": {
          "min": 4100,
          "max": 5300
        },
        "mana": {
          "min": 1100,
          "max": 1500
        },
        "speed": {
          "min": 600,
          "max": 830
        }
      },
      "growthMilli": {
        "min": 1035,
        "max": 1100
      },
      "birthSkills": {
        "core": [],
        "candidates": [
          "beast.counter",
          "beast.regeneration",
          "beast.strength",
          "beast.sluggish"
        ]
      }
    },
    {
      "id": "combat.wild.species.snow-crane",
      "name": "琉璃鹤",
      "realm": "金丹",
      "icon": "icon:beast-snow-crane",
      "description": "身形修长，喙足淡青，羽毛有半透明玉质光泽；背光近乎雪白，迎光展翼透出青碧淡金，常静立于高山灵池。",
      "carryLevel": 45,
      "starter": false,
      "aptitudes": {
        "attack": {
          "min": 780,
          "max": 1060
        },
        "defense": {
          "min": 950,
          "max": 1230
        },
        "health": {
          "min": 3400,
          "max": 4500
        },
        "mana": {
          "min": 2200,
          "max": 2800
        },
        "speed": {
          "min": 1120,
          "max": 1450
        }
      },
      "growthMilli": {
        "min": 1070,
        "max": 1145
      },
      "birthSkills": {
        "core": [],
        "candidates": [
          "beast.miracle",
          "beast.water-attack",
          "beast.wisdom",
          "beast.agility"
        ]
      }
    },
    {
      "id": "combat.wild.species.moon-marten",
      "name": "无影貂",
      "realm": "金丹",
      "icon": "icon:beast-moon-marten",
      "description": "深灰细毛，腹部银白，长尾蓬松；警觉时从尾端开始隐去身形，疾行转折间偶尔露出一道银白腹影。",
      "carryLevel": 45,
      "starter": false,
      "aptitudes": {
        "attack": {
          "min": 1050,
          "max": 1460
        },
        "defense": {
          "min": 780,
          "max": 1040
        },
        "health": {
          "min": 2700,
          "max": 3600
        },
        "mana": {
          "min": 1500,
          "max": 2150
        },
        "speed": {
          "min": 1380,
          "max": 1660
        }
      },
      "growthMilli": {
        "min": 1055,
        "max": 1130
      },
      "birthSkills": {
        "core": ["beast.stealth"],
        "candidates": [
          "beast.sneak-attack",
          "beast.agility",
          "beast.perception"
        ]
      }
    },
    {
      "id": "combat.wild.species.dark-shell-turtle",
      "name": "蛇颈玄龟",
      "realm": "金丹",
      "icon": "icon:beast-snake-neck-turtle",
      "description": "黑青厚甲低伏宽展，甲缝附着水苔，甲下藏着蛇一般的长颈；沉居深潭，探颈观察四周，受扰便收颈伏底。",
      "carryLevel": 45,
      "starter": false,
      "aptitudes": {
        "attack": {
          "min": 980,
          "max": 1260
        },
        "defense": {
          "min": 1450,
          "max": 1680
        },
        "health": {
          "min": 4400,
          "max": 5600
        },
        "mana": {
          "min": 1900,
          "max": 2500
        },
        "speed": {
          "min": 480,
          "max": 680
        }
      },
      "growthMilli": {
        "min": 1090,
        "max": 1160
      },
      "birthSkills": {
        "core": ["beast.advanced-defense"],
        "candidates": [
          "beast.sluggish",
          "beast.water-attack",
          "beast.regeneration"
        ]
      }
    },
    {
      "id": "combat.wild.species.ink-jiao",
      "name": "墨蛟",
      "realm": "元婴",
      "icon": "icon:beast-ink-jiao",
      "description": "墨鳞短角，颈侧生须，盘踞地下暗河，唾液含毒，出水时带起浊浪。",
      "carryLevel": 65,
      "starter": false,
      "aptitudes": {
        "attack": {
          "min": 1230,
          "max": 1580
        },
        "defense": {
          "min": 1120,
          "max": 1450
        },
        "health": {
          "min": 4400,
          "max": 5800
        },
        "mana": {
          "min": 2350,
          "max": 3000
        },
        "speed": {
          "min": 850,
          "max": 1170
        }
      },
      "growthMilli": {
        "min": 1125,
        "max": 1200
      },
      "birthSkills": {
        "core": ["beast.advanced-poison", "beast.flood"],
        "candidates": [
          "beast.strength",
          "beast.meditation",
          "beast.spell-resistance"
        ]
      }
    },
    {
      "id": "combat.wild.species.silverwing-mantis",
      "name": "银翅螳螂",
      "realm": "元婴",